"","marketplace","customer_id","review_id","product_id","product_parent","product_title","product_category","star_rating","helpful_votes","total_votes","vine","verified_purchase","review_headline","review_body","review_date"
"1","US",41192041,"R3GCJJWMTTY996","B003LQSNTA",294255492,"binkibear original brown with jollypop pacifier newborn orange","Baby",5,3,4,"N","Y","The only one my kid can't take the pacifier off of!","My title says it all.  This is better than any of the other ones out there, especially if you have a toddler that's always trying to figure out how to take things apart. My little one is obsessed! Thank you to who made this!!!  We use nuk, natursutten, and dr browns with this guy.  Only problem, where can we buy a pink one!!???",2012-08-31
"2","US",27872049,"RCNM8M7S77A5N","B006PASHMW",578779420,"clevamama microwave baby pacifier sterilizer","Baby",2,1,1,"Y","N","Takes up room than actually helps.","My newborn daughter was given several pacifiers, from the Avent ones to the Gerbers. She prefers the Gerbers, so we bunched them all into this pacifier tree to steam them up.<br />First off, when I received the box, I thought the tree was too small. We put about 6 pacifiers before it was stuffed.<br />Because it's small, they don't fit the Avent pacifiers too well since they don't have rings. Heck, they don't seem to hold any pacifiers if it doesn't have rings.<br /><br />The steamer seemed to work fine, but the tree was too hot out of the microwave. The drainer didn't seem to work well either, so I just had to tip over the bottom to spill the water out.<br /><br />It seems fine, but I wouldn't consider the tree a necessity.",2012-08-31
"3","US",11056950,"R35J89V2ORDFRS","B006G9F8AQ",454116188,"2 pack natursutten bpa free natural rubber pacifier, butterfly shield, orthodontic nipple","Baby",1,1,2,"N","Y","Too big for a newborn, my baby doesn't like it.","I am not sure if it's the shape or the larger size, but my baby just doesn't like it and prefers advent soothies that she got at the hospital. It also changes color a bit once it is sterilized ... so seems weird that it would.",2012-08-31
"4","US",29731525,"R3LY7RP9AUKBCM","B006BHSAB2",52203997,"wubbanub pink bear infant pacifier","Baby",5,0,0,"N","Y","Lov, Love, Love These.  Same pacifier given to babies in the hospital!","My daughter had grown accustom to the feel of the hospital brand pacifiers since she spent a couple of months there after birth.  I frantically purchased several look-a-likes when we came home.  Even at the her tender age of just a few months old, she was not to be fooled by these silly knock-offs.  I had a diva on my hands and she wanted nothing less than the real thing.  I finally discovered that the Gum Drop pacifiers were identical to the ones provided by hospitals. They have a vast variety of styles and colors like [[ASIN:B000ZEXKJE GumDrop Pacifier Full-Term Natural Scent Orange 5 Pack]] and [[ASIN:B007VSM3CM Gum Drop Preemie Pacifier Vanilla Scent (Green)]] for preemies. Finally we were saved!<br /><br />During my search for the holy grail of pacifiers, I came across these wubanubs and bought them mostly because they were super cute.  And since I was starting a collection of pacifiers, I figured it wouldn't hurt to try.  Love, love, love these.  And my daughter does as well.<br /><br />First let me begin by saying that the pacifier, on these precious dolls, are practically identical to the make and material of the hospital variety and perfect for my little one.  They are perfect for little hands to find and grab in the middle of the night.  My daughter just puts her own pacifier back in her mouth.  I only wished I had found them sooner since my other two children are grown.  I could have saved myself from trips to the crib in the middle of the night to give baby back her pacifier.<br /><br />Although, they are a little pricier than a traditional pacifier...you save money by not having to purchase another two pack because you don't know where the gazillion others you purchased went.  I have yet to lose even one of these.  They also make a great toy for baby as well. While the pacifier is in her mouth she tends to play with the plush and tag. It appears to be a somewhat  meditative motion that helps to sooth her and/or occupy her in her carseat/stroller/crib.  So not only is it a pacifier and toy but it helps build motor skills and actually pacify.<br />There are a number of different colors, animals and even textures like this one [[ASIN:B0031W38YO Wubbanub Plush Pacifier Toy, Mango Monkey]]. The [[ASIN:B0028H3ACS WubbaNub Tabby Kitten]] is my favorite.  I have noticed that this one along with the Tabby cat is slightly smaller than the other ones I've purchased but my daughter loves it just the same.  The pacifier itself is sewn very well to the plush; however, I have cut the pacifier out of just one after its seen some wear.  ( Just as a caution.)  Once you stitch the hole back you have another little toy for baby to play with, unlike the plain pacifiers that you have to dump. They make great gifts and additions to a shower basket.  I have bought many for my friends. When you think of the must haves in baby gear, I personally would add this to my list.<br /><br />Update: To wash or sterilize, I place a small plastic sandwich bag around the plush to prevent it from getting wet. I can then wash the pacifier with warm water and anti-bacterial soap or clean with a baby safe sterilizer.  Then I just take a sterile wipe or even a baby wipe to gently rub the plush doll.  It has worked well for me and keeps baby's gear germ free.",2012-08-30
"5","US",10457960,"R1D3ZSPTE3D14J","B006X6KGBI",899854772,"booginhead pacifier","Baby",4,0,1,"N","Y","Mute Button Paci","Smaller than it looks and so the font on the pacifier is pretty small too. A little disappointed because I chose this one over another one that was only about a dollar more ...that one had the cute little semi-circle handle attachment too. Well the nipple size is good for a newborn so it's a keeper.",2012-08-30
"6","US",37028707,"R3RJJ7LV04QJQT","B0028IDXDS",450475749,"wubbanub brown monkey pacifier","Baby",5,0,0,"N","N","Can't think of anything my kid loves more... nope, nothing","We got this for our boy at birth, and within a few weeks, he could hug it to himself.  So, it was about 50 times less often that we'd have to reach over and adjust his pacifier.  The beads inside help to keep Wubba on our son's chest, even when he was very little, further reducing the amount of retrieval we had to do.  That adds up, and you can count it in whatever sanity is measured by.  The monkey is cute and soft, but very durable.  Whenever he gets grungy, he just goes in the wash with normal clothing.  I LOVE this product so much I got the Giraffe to leave at the in-laws.",2012-08-30
"7","US",15126899,"R2U2N8TRR3RJ3O","B001L2SA6M",381226741,"philips avent bpa free contemporary freeflow pacifier","Baby",3,7,12,"N","Y","Can Not Choose Colors","My previous review was denied, and does follow review guidelines. This is what I said previously:<br /><br />Got the package within two days, and for that I am happy!  I am only disappointed that I was unable to choose colors.  I did leave a note that these were for a boy, but received a pink and a purple.<br /><br />3/5 stars for an awesome product with fast shipping but docked for inability to choose the colors of an item you pay for.",2012-08-29
"8","US",48840001,"RQETQ4SOXR7L2","B004VL2VRY",175568661,"motorola mbp33 wireless video baby monitor with infrared night vision and zoom 2.8 color lcd","baby",5,0,0,"n","n","exactly what we wanted","we have been using an angelcare movement and audio-only monitor for our son's first 3 months, and while it has been great, i really don't know how we lived without having video!  now that our son is moving more in his sleep, this helps us know if he's fussing because he's worked himself into a corner or if he's just fussing himself back to sleep.  great for peace of mind and so nice to be able to peek at him without going into the room.<br /><br />the night vision is fantastic and i like that there's no distracting light needed for the camera.  i do plan to mount the camera on the wall so we get a better view, but so far we are very pleased with this purchase.  the two-way talk feature is a nice touch as well.",2012-08-29
"9","us",15087737,"r27j8zwftoa5bk","b004tdc14w",733001760,"blueberry mini deluxe cloth pocket diaper","baby",5,2,2,"n","n","excellent for anyone interested in cds","i am a busy work-at-home mom committed to at least trying cloth diapers.  we ordered pocket diapers from several brands: 1 fuzzinbunz, 1 blueberry, 1 bumgenius and 2 charlie bananas to start with.  we loved the blueberry mini so much we ordered 2 more minis and 1 more large one.  really easy so far and no issues.",2012-08-29
"10","us",28478440,"r3f5nnsrg1j8hy","b003ajxy3i",533404581,"thirsties snap duo wrap","baby",4,3,3,"n","y","no leaks, good fit, sometimes gets smelly","i love that the snaps allow this cover to fit varying size and growing babies. cloth lining makes it very comfortable for baby. this has kept all messes, big and small, inside. every now and then stuff gets on the cover lining, usually when it's a heavy one. heavy or normal messes still leave the cover smelling a bit like urine after a few uses, probably because the lining will soak up moisture also. our routine now seems to be to alternate about two covers a day with hand washing and line drying once a day to prevent stink (obviously a washer wash with bigger messes). not a big deal for us, we just wash it real quick in the shower and hang it in the bathroom.",2012-08-29
"11","us",16017913,"r13yshssi45opd","b000yddf6o",86922018,"baby einstein take along tunes musical toy","baby",5,0,0,"n","n","used it with our first, and now our second!","my husband and i are both musicians and love this toy for our children! when my 5 year old was about 6mo old, we found this toy at a local general store, and picked it up for her for only $10. she would crawl all over the place scooting (more like scratching, but who's counting lol) it on the floor, and when the music would stop, she'd start it again and keep going. when she got older, she liked to take it with her to listen to music, and played the music every night until she was about 2. then we got her a cd player and she only played with this one about 2 or 3 times per week. when we found out i was pregnant with baby number 2, she offered to give her brother her favorite baby toy (it was sweet!). sadly, the baby dropped it off the table (it had been dropped and thrown more times than i can possibly count), and we had to replace it. i love the design of the new circle. it's easier to push and more attractive for a baby's eye. plus the rings around the handle adds to an already great toy and makes it awesome! i have recommended it to many many people, and will continue to do so!",2012-08-29
"12","us",52715908,"rhz9f2th69do2","b002gwvdn8",832693972,"jeep 3-in-1 backpack harness (discontinued by manufacturer)","baby",4,8,9,"n","y","bought for my autistic son","i bought this for my son who has a tendency to suddenly bolt when we are in big crowds. he is 8 and is the size of a 12 year old, so i was worried that it might be too small. but it actually is very big and will likely fit him for numerous years. the only downside is that he can undo the buckle himself, but i'll come up with something to cover it so that he can't. i'm pleased with my purchase.",2012-08-29
"13","us",48608832,"rxgdcku4dtggl","b005s6xi2s",302951668,"itzy ritzy snack happened snack bag, playground superheroes","baby",5,0,0,"n","y","i absolutely love these snack bags!","couldn't live without them and love that i can wash them too!  when my son lost his, we were using baggies like crazy.  i feel like i'm doing something good for the earth and they are convenient too.",2012-08-29
"14","us",23513332,"r1h6tnwe5bc35e","b005k2iums",27308416,"lambs & ivy hello kitty garden night light, pink","baby",4,0,1,"n","y","cute, but tempting for toddlers","i bought this as a replacement for a more traditional night light.  definitely cuter than the other night light, but it isn't as bright (that could be a benefit, depending on what you want).<br /><br />my 2-year old daughter definitely prefers this to the other night light.  she loves hello kitty, and she was absolutely delighted when it arrived.  however, every so often she tries to play with it, which worries me.",2012-08-29
"15","us",46772617,"r1n7fwnjtu3ikc","b001ckyn5a",719481165,"gerber brand 6 pack prefold birdseye organic diaper, white (discontinued by manufacturer)","baby",5,0,1,"n","n","must have for use as burp cloth","i can't imagine having lived without these as burp cloths. baby was super colicky the first three months with lots of reflux and constant spitting up (it took us a few months to isolate his dairy intolerance). i had two packs of these and wished i'd had four. i can't emphasise enough how great they are and how much i've relied on them - and continue to rely on them now that baby is a year old. i'm sure i will use them until they absolutely fall to pieces - whenever that is as they are still in great condition a year later after constant use. i'm now buying them for a friend whose just had her first baby.<br /><br />also noteworthy: when baby got a nappy rash, i used these around the house instead of our regular cloth nappies, just pinned them on both sides. this allowed him to get plenty of air without getting the carpet wet - but i had to change him as soon as he did anything. (obviously didn't use a plastic cover)",2012-08-29
"16","us",44249221,"r3taefkvyherjp","b0069mdtd8",61687732,"fisher price fastfinder deluxe diaper bag","baby",5,3,5,"n","y","handy bag to have. works well","bag is not overly huge but not to small either. had no roblems with it.very comfortable to wear. of course this bag isn't made to please everyone i will say it can withstand some tugging, pulling and plenty of spills. easy to clean. and since i bought it for my wife she thought it was perfect. it suited our needs and most of the time i wear. and as you can see it's quite fashionable lol. i have no problem wearing this. but now if it was pink and flowery.... ehhhh idk. but overall it's a great product. if your a dad and you know you'll be having it with you most of the time, look no further.",2012-08-29
"17","us",20502708,"r17qvj9jarg6bc","b00792kraa",848243517,"manito baby shampoo shower hat / cap / visor / shield (kiwi/orange/strawberry) - 3 available colors","baby",1,3,9,"n","y","don't waste your money!!!","this product was sooooooo bad. water went to my daughter's eyes and she cried. it was our first time try. you shouldn't waste your money for this.",2012-08-29
"18","us",40151441,"r1xfpo4wb0my0l","b002c1axma",867206332,"sugar booger kiddie play back pack","baby",4,0,0,"n","y","cute ladybug backpack","we bought this backpack for our 2 1/2 year old daughter to take to preschool. it is very well made and seems durable, although we've only had it two weeks. it is small enough that she can easily wear it on her back, but large enough to fit her belongings. i am able to fit two extra outfits in this bag, plus a travel package of baby wipes. the shoulder straps are somewhat far apart, but this makes it easier for my daughter to get the pack on and off. she does not have a problem carrying it on her back. the design is cute and i am happy that she doesn't have the same backpack as every other little girl in her class.",2012-08-29
"19","us",14807911,"r9k06f924dzmo","b003lpupvu",516240912,"thinkbaby bpa free no spill sippy cup, orange/natural, 9 ounce","baby",1,3,3,"n","n","no spill but leaks!","don't waste your time with this product. your child will easily get liquid all over themselves. it doesn't spill but it leaks! how? the nipple is separate from it's base and if your baby clamps down on the nipple and distorts it's shape or pushes the nipple into the bottle (which happens so easily) it unlaches from the orange ring/base around nipple and the liquid comes streaming out.",2012-08-29
"20","us",42201043,"r3bz3a17dproum","b002uwn292",269266849,"lambs & ivy jake rug (discontinued by manufacturer)","baby",3,2,2,"n","y","very cute but stitching, border & detail a bit off","matches jake set. very adorable rug. husband noticed that detail is not meticulous, over all very minimal but would have liked it to to be perfect. purchased aug 2012",2012-08-29
"21","us",21523726,"r1bdfpzb8kufnu","b0052qylum",850036950,"infant optics dxr-5 portable video baby monitor","baby",5,0,0,"n","y","for my 80 year old father","a very useful device to keep my eyes on my 80 yr old father who is mobility challanged. this monitor not only works for babies, but is a great tool for the elderly! he's a bit frustrated on the lack of privacy... but i convinced him that his safety was our primary concern and he can cover the camera lens anytime he wants. he doesn't like it, but i love it!",2012-08-29
"22","us",22911139,"rqljfke8wgvr1","b0076wd0w0",899854772,"booginhead pacifier","baby",4,0,0,"n","y","cute!","super cute pacifier, and appears to be good quality. i didn't expect my son to love it since it's more of a novelty pacifier, and he doesn't. he'll tolerate it for a few minutes, just enough for people to see how cute it is. i would buy it again, it was a good price for how cute it is.",2012-08-29
"23","us",32767747,"r9djatbclwi8b","b0080hpwmg",385429388,"britax car seat storage pouch","baby",1,3,3,"n","y","not needed","this pouch is not needed - you can barely see it on the side of the britax marathon car seat. i feel it was a waste of $.",2012-08-29
"24","us",20175022,"rgoz4u4210eh8","b002hmc2b4",902231613,"badger basket barrel top toy box","baby",3,0,0,"n","y","good box, poor assembly.","the toy box itself looks nice and seems like it will be functional for its purpose. however, the actual assembly of the box very difficult. this was because the manufacturer forgot to drill the holes on the front side of the box for the crossbars. i had to go purchase drill bits and drill the holes myself. this turned what should have been a quick put-together into a huge project. otherwise, it was mostly fine. the board in the bottom doesn't slide in or stay in easily during assembly but i don't know if that is because of an issue with the product beyond this or just from the holes i had to drill myself.",2012-08-29
"25","us",28155774,"rjb6lafyey8hg","b002a9iz0q",443857003,"stork craft tuscany 4-in-1 convertible crib","baby",5,0,0,"n","y","love this crib.","i have 2 year old twins and we are still using these cribs. i have loved them the entire time. they set up easily. love that the instructions are on the bottom platform so you can't lose them. we have gone through the chewing stage, there is bite marks but you can only see them when your up close. we are expecting our 3rd baby. i'm do happy that this crib is still available. i will be buying another one. i love that it will grow with our children and we only have to buy them one bed. they are beautiful cribs!",2012-08-29
"26","us",29319671,"r1ar3qylr5jc98","b004l2jjak",847573473,"brica baby in-sight mirror, gray","baby",5,0,0,"n","y","both baby and i love it","i just bought another one of these for a gift, because i think it's so great!  i originally purchased for my baby at 6 months old and i wished i would have had it sooner.  there were times where baby would be crying or coughing and suddenly stop.  was she ok?  i didn't know without pulling over until i got this mirror.  now a quick check in my rear view mirror and i can see how/what she's doing (and sometimes she is doing the cutest things in her car seat :).  also, with the recommendations to leave babies rear-facing until age 2, it's extra nice to have this.  my daughter loves this too -she'll make faces or smile at herself in the mirror.  also, this mirror is not gaudy looking - it looks nice a subtle in any car interior.  i would highly recommend.",2012-08-29
"27","us",30790986,"r2f202lvi0v95m","b002bxomjy",782079575,"sesame 2 count  sheet set","baby",5,0,1,"n","y","great quality! love this!","the first thing i noticed was how soft it all was, right out of the packaging. i rarely write reviews but had to make sure to write one about this set. it was very soft, and i love the fact the top flat sheet has bottom edging so it doesn't just get kicked off by the little ones. almost like a half-fitted sheet, very nice. any kid that loves sesame street or elmo will love this set, my little man loves elmo and i love the fact one side of the pillow cover has a big picture of elmo (the other side is cookie monster) it is not all elmo though, so if you are looking for just him it's not for you. but there is sufficient elmo that my little guy loves it. :)",2012-08-29
"28","us",20861131,"r6qfsv717txty","b004y425tm",552134152,"infantino tap and go musical drum (discontinued by manufacturer)","baby",3,1,1,"n","n","cute, but ...","my son doesn't love it. he will pick just about any toy over it. we got this because, at 6 months, he loves to bang on things. i think he passes this toy over, however, because it is so sensitive to the slightest touch, as another review states. there's no \\cause and effect.\\ also, i do not see how this toy can roll to promote crawling. the sides are not firm enough.",2012-08-29
"29","us",20006024,"r2zxo6iv6224r","b004wozmq2",649434687,"cloud b twilight ladybug - pink","baby",5,0,0,"n","y","adorable","i haven't given this to my daughter yet because it is for her 5th birthday next month but i tried it out. it casts so many stars onto the ceiling. it actually surprised me that it covered the whole ceiling of my bedroom (my bedroom is pretty big). i guess i just imagined it would project enough to cover a small section of the ceiling. my 2 year old son was in the room when i tested it out and he was amazed by all the stars as well. he was mad when i had to put it away. guess he's getting a turtle version of this for christmas. the ladybug is also adorable. i saw that some of the customer pictures featured one with closed eyes but in the main picture her eyes were open. mine arrived with her eyes open and i was pretty pleased about that. i think she's cuter that way. anyway, i think my daughter is going to love it. if not, i'm giving it to my son. :)",2012-08-29
"30","us",47574746,"r2law2a0odlyv4","b005vlx5d2",331555706,"boon swap 2 count 2 in 1 feeding spoon, blue/green (discontinued by manufacturer)","baby",5,1,1,"n","n","love these","started using these for my 5 month old when she started solids.  the spoon width and the angled feeding is comfortable for me and less messy all around.  she also enjoys chewing on these when not eating as a teether.  i will purchase these again in the future.",2012-08-29
"31","us",10737708,"r18jn4hqn77aaq","b005c3itc6",341480529,"breathablebaby breathable deluxe mesh crib liner, pink/chocolate stripe (discontinued by manufacturer)","baby",5,0,0,"n","y","great bumper.","easy to install, looks cute, and serves it's purpose.  also keeps my daughter's legs from getting stuck in between the crib slats.",2012-08-29
"32","us",48272901,"r3do61nmq5q5s4","b004v8vqc8",171100622,"fisher-price discover 'n grow kick and play piano gym (discontinued by manufacturer)","baby",5,0,0,"n","y","great toy","the toy exceeds my expectation.<br />my son enjoyed kicking at it.<br />both my wife and i think it is well worth the money if the kids love it.",2012-08-29
"33","us",46763929,"r1lx2qt99ojjm1","b007u4v2oc",400650078,"rayshade uv protective stroller shade improves sun protection for strollers, joggers and prams black (discontinued by manufacturer)","baby",4,0,1,"n","y","fits any stroller!","i love this sun shade, i previously had a shade for a specific stroller, was great, other than the velcro on the stroller pulled the mesh, and was continually something i was having to fiddle with when folding and unfolding (as long as my stroller when unfolded) i love how this will fit any stroller! my only tweak would be a separate bag for the shade that could hang off the back of the stroller when not in use.  i think the current pocket storage is a bit fiddly to figure out, and i'm not sure i am even doing it correctly.  but all in all, we love this awning.",2012-08-29
"34","us",34991432,"r1ax9uzzhbslsf","b006sfueg6",685529922,"munchkin quick install 26 gate, black (discontinued by manufacturer)","Baby",5,1,1,"N","Y","works for windows too Munchkin Quick Install Gate","The Munchkin website only illustrates this quick install gate for doors, but I bought it as a solution for a window and it works great.  The honeycomb plastic lets air pass thru and keeps toddlers from pushing against the window screen and falling out.  I can tell you that this is very secure if installed on the interior window jam.  My window still is able to slide up and down without interference from the gate.  It can also be removed in seconds if needed to use the window as a fire escape.  The seller on my gate was shipped and sold by Amazon LLC, and shipping was very quick.",2012-08-29
"35","US",16285713,"R7YSO9GS1Y7OY","B001RNV6NO",416377561,"personalized pacifiers mute button pacifier","Baby",5,0,0,"N","Y","Love it!","I bought two of these pacifiers for a friend's Baby Shower. She LOVED them! I think one might be used on the husband... O_o<br /><br />The items arrived swiftly after purchasing them.<br /><br />GREAT quality!",2012-08-28
"36","US",15268147,"R255FSG4WD7GWU","B003ZMLH34",211963857,"mam night bpa free glow in the dark silicone pacifier, 6 months, 2 pack","Baby",5,0,0,"N","Y","glow in the dark MAM","such a great idea to have these glow in the dark i wish more companies did this with there pacifiers",2012-08-28
