"","marketplace","customer_id","review_id","product_id","product_parent","product_title","product_category","star_rating","helpful_votes","total_votes","vine","verified_purchase","review_headline","review_body","review_date"
"201","US",31878391,"R20WL2CPNFN1MF","B000YDFOPE",381226741,"philips avent bpa free contemporary freeflow pacifier","Baby",5,0,0,"N","N","My Son LOVES these.","These are the ONLY pacifiers my son has ever truly liked, and I have tried a number of different types, shapes, and brands with him. They are awesome, and I know my son also thinks so because these are the only pacifiers he wont spit out.",2012-08-04
"202","US",19556822,"R3PWAFP7G3HPVS","B004JCW3RS",246038397,"philips avent soothie pacifier, up to 3 months, 0 - 3 months (was 0 to 6 months)","Baby",5,0,0,"N","N","My baby loves these!","My baby will take no other pacifier!  The hospital gave us this one, and she LOVES it!  I have tried the gumdrop pacifiers because they are supposedly the same nipple as these, but she spits those out.  She instantly calms down with theis pacifier.",2012-08-03
"203","US",46684800,"R1URXGXBQLB0V4","B003CK3LDI",392768822,"wubbanub infant pacifier - giraffe","Baby",2,0,2,"N","Y","Plush permanently attached to pacifier","I purchased this product for my son so he could better hold his pacifier.  He is 6 months and it seems at the top range for the wubbanub.  I was disappointed that the giraffe was permanently attached to the pacifier; I suppose I did not understand completely understand, but I thought it was attached by a gripper of some kind that would allow a pacifier to be changed when it became worn.  The cheaning instructions seem to state that they can be washed seperately, but not sure how it is suppose to work.  Would not have purchased if had realized that fact.",2012-08-03
"204","US",12948278,"R1ZK2XZI88YG3Q","B003YHQ140",969174729,"baby fanatic pacifier (2 pack) - dallas cowboys","Baby",5,0,0,"N","Y","Love It","There really is no difference between these and any other pacifiers just the look.  But beings that my wife is a Packers fan it sure is fun having the Cowboys pacifiers around.",2012-08-02
"205","US",14486609,"R1AFRKH28F24EG","B000VG4608",179903806,"3ct diamond pacifier (278 pave set diamonds)","Baby",5,55,85,"N","N","Important: for all doorstep children!","As is common in these free-thinking, immoral days an unwed single mother left her unwanted child on my doorstep. At first I tried to phone social services they called me a racist homophobe and hung up. The police were similarly unhelpful. What was I to do? My wife suggested drowning him, but the council forces us to sort our rubbish at gunpoint, and which recycling bag do babies go in? It was clearly not the answer.<br /><br />Several times I tried leaving him at the local park, but no-one would take him - not even the strange homeless man with the 'Jesus is Love' sandwich board. It looked like we were doomed to a life or depressing parental drudgery.<br /><br />Then we discovered the 3ct Diamond Pacifier. At first we were skeptical - diamonds are mined in the third world, where poor people live! But we did notice it is pleasingly shiny and pacifier-shaped. Anyway, for less than the price of buying up the whole planet's nuclear weapons, we were rid of our problem! We simply popped it in his mouth and left him in what the proletariat call a shopping mall. He was gone in seconds!<br /><br />Thank you! If only all of life's problems could be solved by buying a $17,000 diamond pacifier. Unfortunately only most of them can.",2012-08-01
"206","US",30470969,"R315KN2XK8G2JU","B006G9F8DI",454116188,"2 pack natursutten bpa free natural rubber pacifier, butterfly shield, orthodontic nipple","Baby",5,1,2,"N","Y","Natural Rubber is the Way to Go!","We love these pacifiers. They are so much softer then the regular silicone pacifiers. Even if you don't get these for health reasons get them because they are much softer and gummier for the baby. We have used them since our boy was born. Even though he is breastfed, we did not have any issues with nipple confusion. He took the pacifier when he was not hungry. When he was hungry he didn't want it. They do have to be replaced once they become sticky. But for sanitary reasons it's best to replace any kind of pacifer after about 2-3 months.",2012-08-01
"207","US",15809353,"R1JXNQUZR71Y0Z","B000ZEZ0MY",93126241,"gumdrop pacifier full-term natural scent pink 5 pack","Baby",5,0,0,"N","Y","Softer than other gumdrop pacis","There are a few companies who make the Gumdrop pacifier and this one is the best. It is the most flexible, soft and lightweight. If your child cant keep the soothie in, get these! I used these until my daughter got the hang of her soothie.",2012-08-01
"208","US",15809353,"R30QHSPWN4MF5T","B0028IDXDS",450475749,"wubbanub brown monkey pacifier","Baby",5,0,0,"N","Y","So cute and easy to find.","If I had seen this in a store I would have never bought it because at first I thought it was impratical. But after seeing such good reviews and seeing that the price wasnt steep I caved, and I'm so happy I did. Trust me when I say if your child likes the soothies they will ADORE this. My daughter doesnt even use the pacifier half the time and she loves the monkey. She has three of these (we had four but the dog ate one) and we keep one in the main areas of the house and one in the carseat. It is her little travel buddy, SO CUTE",2012-08-01
"209","US",15809353,"R3MACCRAC9N2T1","B003CK3LDI",392768822,"wubbanub infant pacifier - giraffe","Baby",5,0,0,"N","Y","Love these!","I love these little guys! So cute, so easy to find, and pretty cheap. Just make sure your kid loves the soothie and your dog doesnt find it before you.",2012-08-01
"210","US",27464302,"R1XR22194D9VZI","B000AKB4IM",295960359,"the original billy-bob teeth two front teeth pacifier","Baby",5,0,0,"N","Y","HA-larious!","Bought this for my friends baby and had some good laughs! and it shut him up for a while too!",2012-08-01
"211","US",15809353,"R2TY4MQ9IQ147W","B004J4VXZ4",585880039,"the first years gumdrop pacifier attacher","Baby",4,0,0,"N","Y","Does what it says.","Does what is needed to do and is good quality however, once again, you cannot choose the color. Doesnt bother me but might bother mothers of boys who could receive any color. (also the color I received: a baby blue, isnt even shown here).",2012-08-01
"212","US",15809353,"RP3S6U722ABCW","B004JCW3RS",246038397,"philips avent soothie pacifier, up to 3 months, 0 - 3 months (was 0 to 6 months)","Baby",5,2,2,"N","Y","As always Amazon is on point.","My daughter loves these pacis and now that shes teething she loves to chew them with my finger underneath. Cute colors and delivered on time. Would reccomend to anyone who has a child that is teething that was/is breastfed as they are more like Mom then other brands.",2012-08-01
"213","US",45287973,"R2CPLX972ZT0XU","B00200LOSA",938291364,"playtex binky silicone newborn pacifier - 2 pack (colors vary) (discontinued by manufacturer)","Baby",5,0,1,"N","Y","nice","I loves these but my daughter hated them she preferred her favorite paci...they r nice and very flexible don't have any hard plastic ,so if u have a wild sleeper they won't b hurt but these if they roll over it or hit it wit their face if it falls out!! :)",2012-08-01
"214","US",23813767,"R3B6WGDDLDC8O3","B006I1ZMJO",897746518,"baby buddy secure-a-toy, safety strap secures toys, teether, or pacifiers to strollers, highchairs, car seatsadjustable length to keep toys sanitary clean","Baby",5,0,0,"N","Y","Secure tethers","These tethers are long enough to allow baby to play the attached toy but not too long to be dangerous.  Snaps securely on both ends.  I'm quite happy and would order again.",2012-07-30
"215","US",32015992,"R1KXCM9XWK7KIA","B006ZM043U",147016145,"nuk hello kitty puller pacifier, 6-18 months","Baby",5,0,0,"N","Y","very nice for the price!","These are the same as other nuk pacifiers except they have hello kitty on them! My granddaughter loves them.  I have sterilized them hand washed them several times already and the image is still perfect.  I was afraid it would rub off, but no worries.",2012-07-30
"216","US",44795549,"R3O8KC99CY1L7J","B00205JY78",981045906,"personalized pacifiers pacifier","Baby",5,0,0,"N","Y","Pacifiers for a new granddaughter","These are the cutest things, and trust me after 3 brothers she is definitely the Princess. The pacifier just helps everyone else to know she is the Princess.",2012-07-30
"217","US",46765835,"R3FOIHN9YCH89P","B0045I6IAO",246038397,"philips avent bpa free soothie pacifier, 0-3 months, 2 pack, packaging may vary","Baby",5,0,0,"N","N","My baby loves this","I have tried Dr.Brown's pacifier and he hates it. Now after my doctor's recommendation I got this and my baby loves it.",2012-07-30
"218","US",14698708,"RYK950ZFLR5FN","B003CK3LDI",392768822,"wubbanub infant pacifier - giraffe","Baby",5,0,0,"N","Y","Great pacifier","This is a great pacifier. I purchased this right before the birth of my little girl and she has been using it since the first day she was born. Its easy to find if its dropped. She loves the softness and print of the giraffe. Its super easy to wash as it is machine washable. I recommend this to everyone. I've purchased another one for a friend since we love it so much. You won't regret it.",2012-07-29
"219","US",44099677,"R186XQ8M6GMHOS","B001WAM98S",24160750,"nuk 2 pack classic silicone bpa free fashion pacifier (colors may vary)","Baby",2,1,2,"N","Y","Love NUK but not in blue and green","My daughter loves the NUK pacifiers but I was very unhappy recieving two packages of blue and green pacifiers when I thought I was getting pink and yellow!",2012-07-29
"220","US",14653886,"R3AL5Y7YQ32NCY","B000VG4608",179903806,"3ct diamond pacifier (278 pave set diamonds)","Baby",4,114,143,"N","N","Perfect for my little snowflake","My daughter is the most precious little unique snowflake, and she deserves only the best items no matter what the cost. Would I ever put a non-diamond encrusted binky in my snookie-wookums mouth? No I wouldn't!  My little princess will be the most fashionable baby in the trailer park that I had to move into after buying this.",2012-07-29
"221","US",40409609,"R3SZEDL94U4AYQ","B0006FHB5Q",626046952,"changing lifestyles safe-er-grip 11.5 balance assist bar","baby",5,0,0,"n","y","mommy's helper safer grip","i bought this, already have two others of two different brands.  i am really impressed with out strongly this one grips.  i will buy more of these.",2012-07-28
"222","us",15896926,"reif18xogcmtk","b003i867wq",801167869,"infantino flip front 2 back carrier, black","baby",2,0,1,"n","n","i like it less every time i try to use it","this always seemed like such a hassle to get on the moby wrap was way easier- would have thought this would be simpler to throw on and buckle but adjusting all the belts and getting him in is a pain. tried to use it more once he got too heavy for the moby and realize how much of a hassle it is. we tried to spend 10 minutes (me and my sister) getting it on my husband so he could walk to teh store with the baby. we gave up after trying to adjust the straps to fit him, get baby in comfortably, rethread the belt (mentioned on some other reviews)...we finally gave up and he took the stroller.",2012-07-28
"223","us",39466666,"r1g9obcyv0a1vb","b004gcjmio",422440378,"safety 1st 4 pack prograde pivot position cabinet and drawer latches","baby",5,0,0,"n","y","affordable and easy to install","initially, i purchased one set to try and since they worked well i bought 8 more sets.  i was very impressed with these cabinet locks.  we do not have exterior handles on our cabinetry and wanted a concealed lock. i followed the instructions, used the templates and had no issues installing the locks.  my baby is just beginning to crawl and has not attempted any cabinet opening yet, but i have tested the doors and think they will hold up well.  i also like the ability to swivel the lock. even though i don't plan on disarming the locks it helped in the installation. i was able to swivel the hook when attaching it to the drawer/door and it made it much easier to get into tight corners.",2012-07-28
"224","us",24501664,"r2hgk10pvkeftk","b002mn3jy2",483688088,"tl care 100% organic cotton nursing pads","baby",3,0,0,"n","y","they are okay.","i started to like the idea of cotton nursing pads and was looking forward to using these. realized that the diameter was too small to cover your breast while still looking like a natural shape. i use the lansinoh which are the best out there because it's got a dry layer, great coverage, and contoured to fit breast naturally so you can't see outline. all lacking with these cotton ones. they are thicker than disposables and flat.",2012-07-28
"225","us",25188493,"r38paab6xygdgi","b00029tcpi",882394437,"stork craft beatrice 4 drawer chest","baby",4,0,0,"n","y","good buy","we bought this for my daughter to match her crib. quality was fair for the price. it was a pain to put it together - we tried to get the parts as organized as possible when we were doing the assembly but it was still a challenge. color was darker than what was pictured. i think the material and make of the product itself is average and parallel to the price.",2012-07-28
"226","us",19612379,"rwvizzgsg1vla","b004i14mga",927954914,"eddie bauer harness buddy, tan bear (discontinued by manufacturer)","baby",4,2,2,"n","y","great toy...","we introduced this product to my daughter first as a toy, then after a couple weeks a harness. it works great, with the exception that the tail attaches so low it throws her off balance if she comes to the end of the slack. my daughter is very independent and this allows her enough freedom to strut her stuff.",2012-07-28
"227","us",27056590,"r1k3piwof7zfte","b002v92xas",145446367,"munchkin arm & hammer diaper pail","baby",1,0,1,"n","n","dislike","i hate this diaper pail. you have to push down and pull up to drop the diaper in which is not an easy task when you have a dirty diaper in your hand. gross! i wish i registered for the one that had a foot peddle. oh and it's a never ending expense with having to buy the refill bags but thats with all the diaper pails.",2012-07-28
"228","us",22220602,"r3n4xrlsho9pnw","b000l9jmcm",698814449,"bunnies by the bay rutabaga bunny","baby",5,1,1,"n","n","still a favorite at age 6","my daughter got her bunny at one year and still loves it now nearly 6years later. this is hands down the best quality stuffed animal for a young child. it weathers many washings while retaining its softness. i have looked for a cat of this quality for my younger daughter who adores kitties and have had to buy several cats because they just don't last the way this bunny does. even though my daughter doesn't sleep with her bunny every night anymore, she still goes on all trips and gets dressed in lots of different outfits (other doll clothes fit!) and we have fun sewing our own dresses for the bunny! this is a purchase you won't regret.",2012-07-28
"229","us",35831842,"r7tucx2kj8ng1","b004o6m4m8",730131321,"colgate eco classica iii dual firmness eco-friendlier crib mattress, organic cotton cover","baby",4,1,3,"n","y","good product","i originally purchased the colgate eco classica i crib mattress, beige because this product was supposed to take 4-6 weeks to ship.  however, i returned that item and purchased this one instead when a few days later it was in stock and ready to ship within a couple of days.  i'm glad i exchanged the items, because i prefer that this mattress is dual-sided in terms of firmness.  the fabric on this one is not quite as fancy as the other one (which was a smooth cotton damask), but for the price (this one is only $10 more), i hope to get more years of use.  the firmer side seems a bit less firm than the eco classica i.  the product is light, so easy to maneuver, and was well-packed.  there was no smell after unpacking the mattress, and it fit my baby europa palisades crib perfectly.  i haven't tried fitting sheets on it yet, and the baby hasn't arrived yet, so i can't comment on actually using it just yet.<br /><br />9/25/12 update: after over one month of use, still happy with mattress.  however, we did flip it over to use the slightly softer toddler side for our one-month old.  the softer side plus a more padded organic cotton mattress pad seemed more comfortable while still being safe, though obviously she cannot tell us if it is or isn't.",2012-07-28
"230","us",13320481,"rd4jx1gvdpns6","b001gq2sa2",485261491,"fisher-price precious planet 2-in-1 projection mobile","baby",5,0,0,"n","n","long product life, lasts through toddler years!","this mobile is great because it is also a projector that plays cute music and can be used as a night-time music player much past baby years. it shines just enough light and plays music just long enough to be a great addition to your bedtime routine! excited to pass it on to baby #2 soon, if our 3 y/o will part with it!",2012-07-28
"231","us",35010609,"r2hx8pcp3fo9ck","b000jvtt98",499575461,"summer infant tub time bubble maker","baby",5,1,2,"n","n","my kids beg me to turn this on.","we got this as a christmas gift for my 18 month old, and i stored it. i finally pulled it out when my goddaughters came to spend a week with us, and i needed something to entertain 4 children while i washed the entire crew down. it was a huge hit. reviews that there are few bubbles may have to do with poor or old bubble solution. it does use a lot (but it makes lots of bubbles,) and when i went to get more bubbles out of my closet, the old bubble solutions and the cheap ones, did not work nearly as well as the newer, better quality ones.  the difference is dramatic... gobs of bubbles with one, hardly any with the other. of course, i have dropped it into the water already, and it is still working. you do not want to leave the bubble solution in after you finish using the toy.  i did and when i started it up again after 5 days of non use, part of the solution had evaporated, leaving a thicker fluid and the motor had a hard time moving the wheel around - it also produced minimal bubbles.  so, empty it if you are not using it at every bath time. if it broke today, i would buy it again. at only $12-13, what do you really expect?",2012-07-28
"232","us",29473661,"rbniqbcjznwfw","b000rfcxik",354521277,"munchkin formula dispenser combo pack","baby",5,5,7,"n","y","way better than sassy on the go formula dispenser!","i loved this formula dispenser! you can't really tell from the picture that the side with the lid is funnel shaped, which makes it easier for the formula to flow out into the bottle. i nursed my daughter at first, so i only needed it for 6 months, but it held up well.<br /><br />why it's way better than sassy on the go formula dispenser: at first i bought the sassy on the go formula dispenser and hated it. there is no funnel under the lid, it's just flat, so some of the formula would go into the bottle, and the rest of it was stick inside the container. why bother premeasuring the exact amount you need if you can only get part of out of the container? go with the munchkin dispenser.",2012-07-28
"233","us",40528253,"r2px5qkinp5f1t","b003efhdey",661335537,"small paul by paul frank infant care gift set","baby",3,0,0,"n","y","not impressed","i was informed last minute that my aunt was throwing a baby shower for my mother, and i couldn't make it. as a result, i was shopping around for a gift that i could have shipped to the house. i thought these looked cute and wasn't too disappointed when i saw then, although the quality isn't great. the monkey images are just stickers and the one on the pacifier has faded pretty fast (not a huge deal, but still  . . .). my biggest complaint is that the product doesn't describe the nipple size. i assumed that the 4oz ones would work for a baby under three months, but the flow was too high. now that she is 3 mos old and eating somewhere closer to 6oz, she can finally use them. basically, i don't think we're going to get a whole lot of use out of the smaller bottles and, had the product description warned me of that, i probably would have elected to buy something else.",2012-07-28
"234","us",45799638,"r1c5hznfkveo77","b0054g1jsm",594491663,"summer infant cradler, ivory","baby",5,0,0,"n","y","a good buy","it helps my baby alot and he likes it so this is a good product to by and it will last a long time for u and your baby",2012-07-28
"235","us",43619423,"r9qaoh7h7qlfd","b000jjk9ey",458960456,"go-go babyz travelmate car seat travel stroller for toddler car seats","baby",5,1,1,"n","n","durable wonderful","amazon doess a terrible job with the pictures and description on this.<br />we bought an older version of this car seat -to-stroller airport accessory over 5 years ago with our first for flights after struggling through airports on our first trip as parents. it has been a lifesaver from day 1! we've now taken it through about 20 airports about 50 times, with kids from 8 to 40 pounds, all with a britax roundabout car seat. still drives easily. still opens and closes easily. it has been years since we found a security gate that it didnt fit through, and if we'd had the quick release wheels then it would have been a non issue. we even have belted it in on the plane attached to the car seat as is. we see many more cumbersome baby transport options at the airport, but never one easier. even my spendthrift husband reported that it paid for itself the first time we used it.",2012-07-28
"236","us",30325675,"r3ktjq4kvkyo44","b001ebj9d8",168679462,"soft booster seat","baby",5,0,0,"n","y","prince lionhart orange booster seat","this booster seat is the best...no annoying straps that no one uses and just get in the way... soft and easy to stay on<br />and easy to stay in the chair where you place it.  love the orange color as it blends with my decor.  my grandson was<br />delighted when it arrived and we were able to remove the two phone books he had been sitting on.  (it arrived in a speedy<br />manner as well) i am more than delighted with this purchase....and his other grandmother upon hearing my praise, bought<br />one too...in black.",2012-07-28
"237","us",51730980,"r2bm2m04d6w38h","b004vl2vro",972673046,"motorola remote wireless video baby monitor withcolor lcd screen","baby",5,0,0,"n","n","i love this monitor!","we have been using this motorola mbp36 monitor for over a month and it is great!! this is actually our third monitor and by far our favorite. for our 2.5 year old, we started with a sound-only monitor. it worked well but we realized how helpful it would be to see him. our first video monitor broke so, when we had our second child, we decided to try motorola and i'm so happy we did.<br /><br />pros:<br />+so so easy to set up! we just placed the camera on a book shelf in our daughter's room and used the buttons on the side of the screen to get a good picture.<br />+the picture is really clear and our camera isn't even that close to her crib. if i hear her fussing, i love being able to see if she is standing (not going to go to sleep) or laying down (going to go to sleep). such a huge help!<br />+great range. i can take it in the backyard or the basement when i'm with my son and still see whether my daughter is asleep.<br />+easy to navigate and i love the color indicator on the top to see whether she's crying if i have the sound turned down.<br /><br />cons:<br />honestly, i don't have any. i'm really happy with this monitor. third times the charm. :)",2012-07-28
"238","us",50685780,"r3hkovq8330xzy","b000xpwxk2",43414284,"bumkins waterproof superbib 3 pack (6-24 months)","baby",5,0,0,"n","y","comfy, cute, practical  - the best bibs!","love these bibs because they clean easy, wipe right off for several uses and then throw in the washer later. best of all, they're soft & fit snuggly around baby's neck to actually serve the purpose of a bib",2012-07-28
"239","us",22549670,"r13qohjk5lzv26","b002by6xae",981467143,"cocalo turtle reef wall decals (discontinued by manufacturer)","baby",5,0,0,"n","n","worked fine for me!","i got these for my son's room.  we have no texture on the walls but they are painted with satin finish paint.  they stick fine, and as we have moved furniture around, i was able to reposition them on the walls.  i am now using them in my other son's bedroom as well.  one room is painted a light lime/mint green, and the other is a light blue (but darker than baby blue), and they look good in both rooms.  i like that as they get older, we can just peel them off the walls and don't have to repaint.",2012-07-28
"240","us",26075724,"r3uimzg3g6ske9","b004l2jjak",847573473,"brica baby in-sight mirror, gray","baby",5,0,0,"n","n","quite satisfied with this mirror","we took a long road trip with the baby just a couple months after his birth. this mirror was great, totally necessary--i would say definitely get one if you plan on being in the car for more than 5 or 10 minutes at a time. it is large enough to have a good view of your kid, to see if their pacifier has fallen out or their head is at some ridiculous angle to their body, etc. it was a bit annoying to install, but after that it's very easy to adjust, and it wraps around the headrest in such a way that it won't fall down. plus it's just not that heavy so it wouldn't be a big deal if it did happen to fall down. which it won't.<br />it's easiest to install if you have a headrest, but if you don't, i remember there being lots of options for installation--i'm sure you could attach it somehow.",2012-07-28
