"","marketplace","customer_id","review_id","product_id","product_parent","product_title","product_category","star_rating","helpful_votes","total_votes","vine","verified_purchase","review_headline","review_body","review_date"
"581","us",40855614,"r38xox7hysl2zy","b0042d69uq",65237224,"fisher-price baby's bouncer, adorable animals","baby",5,10,13,"n","y","a godsend","of all of the things we've bought for our baby, this is the item i appreciate the most.  this fantastic chair is super lightweight and portable.  when our daughter was only a month old, we'd put the chair in the kitchen so she could be with us while we cooked and ate.  we move it all over the house.  she is now 5 months old and she still loves the chair -- and the toys that come with it and easily attach/detach.  this is the best $$$ i have ever spent on anything in my life.",2012-03-13
"582","us",49489839,"rggtfqcf0l9ak","b003ouwips",260880930,"britax advocate 70 cs click & safe convertible car seat (previous version), cowmooflage (prior model)","baby",5,0,0,"n","y","great product","this car seat really lives up to its hype. it is very easy to use and my daughter loves. thanks amazon!!!",2012-03-13
"583","us",50477941,"r3vb1i9igama8r","b000maerlg",935933961,"chicco cortina keyfit 30 travel system, adventure (discontinued by manufacturer)","baby",5,0,0,"n","y","simple, functional... just what we were looking for.","we purchased this car seat for our daughter and it has worked out perfectly. we have the \\latch\\ hooks in our car, so installation is a breeze. the only thing i would change about it is the overall size. it simply does not fit anywhere but in the center of the back seat. i know that's the safest place in most cars, but, our bmw 3 series just doesn't have the room to put her anywhere else, even though i'm sure it's just as safe. the stroller itself is bulky, as all the rest of the reviews have said, but we haven't had an issue with it. it still fits in our trunk, so that's all we care about.",2012-03-13
"584","us",15442845,"r1fpf0hh56j82e","b004v8vqc8",171100622,"fisher-price discover 'n grow kick and play piano gym (discontinued by manufacturer)","baby",5,0,0,"n","y","wonderful play gym","i bought this play gym for my 3 month old daughter. she loves to kick so much i thought she would enjoy the piano. she fell in love with the mirror and the piano feature. she moves around so much on it that she move out of the view of the mirror and then become frustrated because she can no longer see herself. i would definitely recommend this play gym. it has a lot of features to keep your little one entertained and bright colors to excite them. my daughter also loves to have tummy time on the mat too.",2012-03-13
"585","us",21948181,"r2xpy129a6gw0o","b004k6qm0m",186015245,"prosport high back booster in envy","baby",4,1,1,"n","y","another great product from recaro!","we bought this seat for our 3 year old daughter and passed on her \\proride\\ carseat to our 1 year old daughter. we love both carseats! i really love the new way to adjust the height of the shoulder straps i just wish you could do it without taking the seat out of the car. that being said, we rated it 4 out of 5 stars because it is not so easy to install the seat into a car. the latch system is pretty simple to use but it is still not the easiest thing to do especially when trying to get the seat really snug.",2012-03-13
"586","us",35602790,"r25yomlnktk62m","b005ubclla",187775854,"britax boulevard 70 cs convertible car seat, blueprint (prior model)","baby",4,0,0,"n","y","easiest installation ever!!","i researched and researched which car seat to buy for about a month. after not being able to find a store that carried this car seat in my area (so i could go play with it) i found all the other reviews to be my insight to this car seats pro's and con's. i went with the highest rated car seat on the nhtsa website. the instructions for the installation was super easy to understand and follow. installation was just as easy (using the latch system). the car seat will not budge and the rubber base really helps with that stability. my daughter is 16lbs and very small for her age and it fits her very comfortably and she has not shown me otherwise. she is still facing backwards. the only con i have on this car seat is the sides (that would protect her head in a car crash) are much like horse blinders. my daughter still doesnt seem bothered by it. i could see a child being bothered by it if they were used to seeing out on the sides or they just needed that stimulation. i love that it clicks once the chest straps are tight enough. i find it reassuring. the height of the headrest is also very easily adjusted. it is easy to strip off the covering in case you need to wash it. its all around the best car seat for me. i drive a toyota highlander and the back seat it slanted a bit. i did have to roll up a towel to even it out for the \\level\\ requirements.",2012-03-13
"587","us",30413875,"r3hbeo9qyteiwu","b002sg7jsu",42092451,"prince lionheart corner guards","baby",5,0,0,"n","y","perfect for children's safety","received this item last week.  easy to install.  used them on our new bar counter top.  in the 2 weeks that we lived in the house, we had 1 accident and 3 near misses with our children running around in the house.  this has made the corners very soft, just incase they get too close again.  the color is a little lighter that what i had thought it would be, but it still blends in with our counter tops.",2012-03-13
"588","us",46726777,"r3efmenqg42yem","b003zhl450",414535829,"nfl dallas cowboys 2 pack sippy cup (discontinued by manufacturer)","baby",1,2,2,"n","y","disappointed","well my husband is huge cowboys fan, so for our grandson these looked so cool, and we have orderd the baby bottles for him and loved them, any way back to the sippy cups, they suck. my grandson turned red trying to suck on them and then throw them, my husband tried to get juice through them,and could not get a drop, so yes they are spill proof, but also drinkable proof too. look cool but kinda useless.",2012-03-13
"589","us",42548330,"r35xj11ewdh9c","b0053osol0",954786703,"kissa's one size antibacterial wet diaper bag","baby",1,8,8,"n","y","not waterproof","i am really disappointed with this wet bag. the bag doesn't keep the moisture in. i put a soiled diaper in the bag, zipped it up and placed it in my diaper bag. i later returned to find that my clean diapers were damp from placing the bag on top of them. i have to place a plastic bag around the outside so nothing else will get wet. had i known this about the bag i would not have purchased.",2012-03-13
"590","us",10931816,"r1mwx80jo4mwfd","b004xi35am",579064203,"chewbeads cornelia teething bracelet, 100% safe silicone","baby",4,4,5,"n","y","cute!","my daughter loves chewing on these. my fear however is that the regular elastic holding the beads could snap so i'm constantly checking how it's holding up before letting her play/chew on it.",2012-03-13
"591","us",19434380,"rrvciml2u7an2","b002tito94",256989091,"boba 2g baby carrier - pine","baby",5,5,7,"n","y","love our boba!","i highly recommend the boba 2g! as an experienced babywearer (stretch and woven wraps) i have to say that the boba is up there at the top of my favourite carriers list. we're on a tight budget so price was definitely a deciding factor but if you're considering a soft structured carrier, don't let the lower price of the 2g fool you into thinking that it's not as good as a beco or ergo. my 19lb, 14 month old rides comfortably on my back or front  and i can wear him for extended periods of time without getting a back ache.",2012-03-13
"592","us",32753621,"r3dnt0muap19dc","b000eigjq2",979920777,"dreambaby chelsea swing close gate combo pack","baby",5,0,0,"n","y","totally impressed","this gate is amazing.  i have 3 of them set up in my home.  they are a little more difficult to install than the usual baby gate, but once it's done, they are wonderful.  i had other pressure gates that wore the wood down on the door casing so i had to keep readjusting so it would be tight enough, and then it would wear the casing down further.  with these gates, the presure holds the gate in place, but the swinging part of gate never touches the wood casing.  what a brilliant idea!  i would recommend this gate to anyone, not only for children, but pets too.",2012-03-13
"593","us",10937982,"r1ftlp9ycrgdiy","b002riprba",352071701,"kid-ding waterproof crib pads - 2 pack - 27 x 50","baby",2,0,0,"n","y","leaks when wet","didnt really serve the purpose . i had to keep checking on it every time my baby was on it.",2012-03-13
"594","us",43199013,"r1pbym9unc6rqm","b002s0nvmo",313823728,"keekaroo karoo lightweight stroller, crimson red (discontinued by manufacturer)","baby",5,0,0,"n","n","light but sturdy","i use this stroller for my 2 year old, and she has plenty of room to sit comfortable or to lie back and nap. theres a small puffy pillow by her head built into the seat. the basket underneath is big, and the handles are taller so theres no hunching while pushing.",2012-03-13
"595","us",15198108,"r21i33asnx5bgs","b004239ynu",847171018,"summer infant 2 pack cotton knit swaddleme, white/pink, 7-14 pounds (discontinued by manufacturer)","baby",5,0,0,"n","y","sleep all thru the night!!!!","this is a must have! my baby is restless and this baby swaddler was a life saver! my baby actually wants to be swaddled, it makes her feel all cozy like she was in the womb. when she is feeling a little stressed out, i just wrap her in this and she calms right down and falls asleep. one recommendation is to make sure the velcro is covered before washing as it make snag other fabrics. also, i didn't know this before, but the little slot in the booty are is for a car seat or swing buckle, so your little one can be snug as a bug but still safe in their seat. definitely recommend this.",2012-03-13
"596","us",33381913,"r2ibo27nbz7ynw","b006udlxfw",483902006,"boppy travel pillow, mama dot/basket green (discontinued by manufacturer)","baby",5,0,0,"n","n","love this thing.","ladies, i love this thing. debated buying it for a month or two (since there was little customer feedback on the product then), and finally broke down and got it. so glad i did.<br /><br />i wish they would have had this pillow available a few years back when i had my first son.<br /><br />makes breastfeeding in public much more comfortable and relaxing for both me and my baby, esp since i have huge ta-tas and it's hard to just pop him on and off...<br /><br />the one small flaw would have to be the clasp on the shoulder strap. i see why they had to design it that way, it's just a little difficult to undo while you're holding an infant. other than that, it's amazing.<br /><br />a must have for moms who are out and about a lot!!!",2012-03-13
"597","us",43482434,"r27vj657ri0vc4","b002qz64t8",944415547,"bummis reusable fleece liners","baby",5,0,0,"n","y","so far, so great!","i switched to cloth diapers a few months ago due to my daughter suffering from frequent rashes. we were trying to rid her of a nasty yeast rash while using cloth. so, i decided to try these liners to 1. keep her skin dry and 2. protect cloth from barrier cream! i am happy to report these liners keep her very dry in terms of a barrier between prefold diapers that are absorbent, but wet feeling. this is the perfect solution! i am very thankful for this product and will continue to use them. not to mention, they do a great job protecting cloth from poo :) they catch the poo and keep the cloth diaper cleaner. great product!",2012-03-13
"598","us",23427525,"r2dzt42yympm9v","b004j4vt4e",162721703,"graphique home decal","baby",5,1,1,"n","y","quality item","very satisfied with this item. bright, colorful & easy to apply. my son loves it & adds color to my walls without paint.",2012-03-13
"599","us",45549227,"r1j309hxfwgzps","b0000482f9",354478589,"safety 1st blind cord wind ups","baby",1,0,0,"n","n","safety hazard","although the design of these is to wind the cord shorter, when a window is open and blinds are drawn the cord does get longer. i left a room for 30 seconds and came back to see that my son had pulled the cord down and had it wrapped around his neck. terrifying. although these do pop open easily, they most definitely did not pop open from the pressure of a child's neck which i find to be a serious design flaw. from a company named safety 1st - back to the drawing board on these!",2012-03-13
"600","us",23131329,"r10gsfakk6nbsv","b004ho5866",134431014,"jeep cherokee sport stroller, react (older version) (discontinued by manufacturer)","baby",5,0,0,"n","y","stroller","i love it it comes as shown in picture it is easy to assemble as i did it myself i took it out and it didn't fall apart on me the packaging was good ups in the stroller box no rips in box and it came early than was given will order from seller again",2012-03-13
"601","us",13978374,"r3ehdoq83x3ado","b000av5lz8",123028472,"mommy's helper contoured cushie step up, 1 count","baby",2,0,0,"n","n","nice concept needs work!","i love this concept! my son is able to climb up to the toilet safely and independently. however when he climbs up the seat often moves back and leaves a gap infront. when this happens his urine shoots out the gap down the front of the toilet and all over the floor. this product needs some adjustment to make it more efficient.",2012-03-13
"602","us",44014749,"r1s5a8cj4klc2v","b0033og86k",334374129,"jj cole outdoor blanket,blue orbit, 5' x 5'","baby",5,0,0,"n","y","great picnic blanket","we had been using a standard blanket for picnics but if the ground was damp or full of debris then we were sure to have problems. this blanket is very nice. fold and stores easily. its large size accommodates the average family and it wipes clean.",2012-03-13
"603","us",25400461,"r1entlkh7cw0sf","b0043d28bo",47009526,"lamaze cloth book","baby",5,0,0,"n","y","perfect first book!","this is the perfect first book! i purchased this for my 9 month old granddaughter for christmas with the hope that her interest in books would begin early. she's very attracted to the vibrant colors and picks it up often to look through it. after reading the book, we go back through it and i name all the colors and make up more stories about each of the very cute characters and other illustrations.",2012-03-13
"604","us",40295386,"r2uaures28kqtq","b002yqqqjw",235815365,"fresh n freeze reusable baby food containers","baby",4,0,0,"n","y","good for baby food","i do love these for freezing baby food after we make it.  just be careful to not fill them too full or they will expand and the lid will pop off.  the lids don't screw down too awfully tight, but they do stack great and store great!",2012-03-13
"605","us",35005540,"rxaoxdvpaj0iv","b005fpt51k",555425298,"ibaby monitor m3 wifi digital video monitor with night vision and two-way audio for iphone and android","baby",5,3,5,"n","y","fine by me","had no problems with installation.  perhaps 20 mins.  software is as advertised. no bells and whistles, just a monitor for ios that works.  going to get a 2nd one.<br /><br />bought a 2nd one.  again no problems whatsoever. i can toggle between the cameras with the software by two finger swiping.  ez.",2012-03-13
"606","us",27125544,"r1b9f1jfwug5dp","b000p007fi",972330215,"kidco stairway gate installation kit","baby",4,0,0,"n","y","helpful product","this kit was very helpful. i was very relieved not to have to drill into my railing post. this product is very solid. i did not use the 1\\x2\\ wood as my child gate came with one that was the same color of my railing. my only request for this product would be that i wish it came in different colors, possibly made out of wood.  now my railing and child gate match but i have these white blocks that stick out like a sore thumb. over all, i am satisfied with this kit.",2012-03-13
"607","us",43076779,"r2eqnteatvpx7q","b004vl2vro",972673046,"motorola remote wireless video baby monitor withcolor lcd screen","baby",5,0,0,"n","y","motorola monitor","i bought this not for a baby but for a way to keep a watchful \\eye\\ on an elderly parent. it has been the perfect way to give her some space and not intrude all the time. but yet make me feel better i can see and hear how she is doing. i can hear her clearly and she can hear me. for her she still has her privacy as you can turn off the visual feed. our house is cut up in levels. and this is the perfect way to not have to run up and down steps. this was the best thing i could have gotten for our situation. no interference from phones, computers or cell phones. picture is clear both in daylight and with night vision.",2012-03-13
"608","us",23456382,"r57q1qq6eluzr","b003g2yusw",20165375,"fisher-price talk to baby digital monitor, white/blue","baby",5,1,1,"n","y","really nice moitor!","it is just right for my needs to keep an ear on the kids. lasts good and battery works great!! it is clear and the volume switch is good.",2012-03-13
"609","us",28053759,"rqjyhgdkj82tr","b001qnd3rc",521829813,"pampers swaddlers preemie mini pack 20 count","baby",4,8,10,"n","y","good fit","these seem to fit my newborn son (6 lbs 4 oz and 19 inches long) better than the newborn diapers, even though he isn't a preemie.  the backs go up a little higher than the regular newborns but it doesn't seem to get in his way so that's okay.  swaddlers in general are some of the best diapers i've used.",2012-03-13
"610","us",12900283,"r14h2uuhzo3gc4","b004hfqoli",820728887,"philips avent bpa free classic infant starter gift set (discontinued by manufacturer)","baby",5,0,0,"n","y","have used this brand for every child","i love the avent product line.  since i last used them, they have definitely improved.  with the new rings that hold the nipple in place, i don't have any issues with the bottles leaking.  this was a very nice surprise and a change that i don't mind completing an extra step for.  as usual, they hold up great and limit the fussiness.  the pacifier covers are lifesavers since i hate putting them into the diaper bag without protection.  with the cover, i no longer have to put the pacifiers into a ziplock bag to keep them clean.",2012-03-13
"611","us",41512908,"r2v5w8ql82mgcc","b000yddf6o",86922018,"baby einstein take along tunes musical toy","baby",5,0,0,"n","y","great gift","this was a great toy for my two granddaughters.  it's just the right size for their little hands and \\grabs\\ their attention with the flashing lights and variety of music. the price was very reasonable.",2012-03-13
"612","us",20612206,"r2y0kvyohu8o72","b0012vpbms",114044317,"instant murals 7 under the sea wall transfer stickers - tropical fish","baby",4,1,1,"n","y","transfer stickers","once i got these transferred to the wall they look beautiful but they can be a little temperamental getting them on . i would buy them again and recommend them as a beautiful addition to walls.",2012-03-13
"613","us",18587001,"r2wehqxi9p848x","b003ltzxh2",299710403,"earthlust birds and bees baby bottle","baby",5,0,1,"n","n","earthlust baby bottle","received on time and in good state. my baby will by born in june, so i haven't used it yet :(",2012-03-13
"614","us",50573824,"r2d9l78cr3dwp9","b004vqf95u",389087966,"fisher-price discover 'n grow twinkling lights projector mobile","baby",2,1,2,"n","y","highly disappointed","glowing globes were nice, but do not rotate.  the only thing that rotates is not a focal point of the unit, and is tiny.  music adjustment is 3 levels of volume:  off, super-quiet and quiet, neither of which is suitable if you use white noise machines as it's not loud enough.  the projector is a farce.  i thought i got a good deal, but an old school, mechanical wind-up beats the pants off this thing.  assembly is easy and construction seems sturdy enough.  in the end for such an impressive-looking feature set on paper, this mobile is quite a dull immobile.<br /><br />would not buy again.",2012-03-13
"615","us",13724549,"r23sxx0kvsjc","b001cwb3kg",723849,"carters easy fit velour crib fitted sheet","baby",1,2,9,"n","y","elastic gives out...","the color is great, the material is super soft & washes well. . however, the elastic gives out making the sheet useless! i would not recommend that anyone buy this. loose bedding in a crib is very dangerous, carters needs to change the elastic used in making these sheets.",2012-03-13
"616","us",11080372,"r15rkeaa3vsdll","b004furiom",739034963,"jj cole norah diaper bag","baby",1,1,30,"n","n","i would rate this transaction a zero if i could.","this was a poorly handled transaction from jj cole.  they pre-advertised this bag for pre-ordering, which i did.  then weeks later, it was delayed.  well, babies don't get delayed, so my friend was patiently waiting for the bag i told her i would buy as a baby gift.  delay after delay after delay, i finally got an e-mail saying it was sent.  i didn't even have an option to cancel the order.  now, as the baby is six-months old, it is nice that the bag finally arrived.  my friend had to use one of those re-usable \\green\\ grocery sacks.  just pitiful.  and, the bag seems much smaller in person than it appears as advertised.",2012-03-13
"617","us",51454963,"r1ckzb8jv2va1r","b00073hjg8",337629353,"prince lionheart jumbo toy hammock","baby",5,1,1,"n","y","exactly what is to be expected!","as a young adult i found i've acquired many stuffed animals but had no where to put them short of storage. i ordered one of these and it was here almost immediately. not only that but it holds far more than i was expecting. even left with a little slack it doesn't hang too low. i'm even thinking about buying one for my 2 year old nephew. i'm 100% satisfied with this product and the seller. will buy from again!",2012-03-13
"618","us",30355513,"r2utgny2c3ngmf","b005ditigq",648612550,"lamaze ls 50 lightweight stroller - brown/teal","baby",5,3,3,"n","n","great stroller","i feel the need to write a review here because the one star from the other review has to do with amazon's price not the great stroller. small, easy and well priced (yes, cheaper at babies r us... when can you say that?)! i give it five stars for what it is - although i will be getting the uppababy g-luxe so my baby can take naps better in it!",2012-03-13
"619","us",18065276,"r24nwkmbcj5d52","b004el8bdy",457500165,"bumgenius one-size hook & loop closure cloth diaper 4.0","baby",5,0,0,"n","y","great purchase!","we bought 3 covers and originally i planned to just use them for my 21 month old for a few months before we potty train. but i gave them a try on our 2 month old baby boy and they also work well for him! i'm really pleased. i also bought the thirsties hemp/cotton inserts to use with this cover and i'm glad for that purchase too. the thirsties/bumgenius combination absorbs a lot of the wetness so i'm not changing diapers every half an hour.",2012-03-13
"620","us",38589679,"r19firhmtw66ab","b002g9utpy",290367050,"jj cole collections storage box, green stripe, 6.5 (discontinued by manufacturer)","Baby",5,1,1,"N","Y","Nice item","This collections storage box easily fits in my pantry for storing plastic spoons, forks, napkins etc. Love the color.  Looks very pretty.  Could be used as storage under a sink or even to store magazines.  Pretty enough to have in your living room.  Very pleased with purchase.",2012-03-13
"621","US",28112564,"R3656I36HDSQUE","B001AS52FY",119280615,"pacifier billy bob pirate black & skull","Baby",4,0,0,"N","Y","silly & cute","Great idea for a pirate baby  or for someone who wants to inject a bit of humor into the traditional pacifier.  Not inexpensive, but fun for a shower gift.",2012-03-13
"622","US",23070052,"R3GV6RO1AMUSLJ","B004IY3CBS",978656456,"mary meyer wubbanub sweet chocolate plush pacifier, blue","Baby",5,0,0,"N","Y","he adores it","Our son has had one of these since 6 months, and now at 12 months is more attached to it than ever.  we now own 3!  They're adorable and practical.",2012-03-12
"623","US",35531341,"R2U8N1W62Y5ZA7","B001FGL9X0",812583172,"wubbanub brown puppy pacifier","Baby",4,0,0,"N","Y","Good to use at night","I bought this pacifier because we have already lost 4 of the regular ones when my baby was only 2 months old. So I decide to buy it and use it at night, because it was really easy to find when you are so sleepy. Really good purchase, I still have it and my son is 6 months old, now is not only a pacifier but also a toy for him.",2012-03-12
"624","US",13003076,"R16OKP8RJ4H5DY","B002LH7KFI",52118951,"bink link pacifier attacher by fruitabees - skully","Baby",5,0,0,"N","Y","Awesome!!!","My husband and I love this bink link!! It looks really cool and it's so unique. My son loves it as well and is constantly playing with the beads. The length is nice, it's not too short or too long, and the clip is very durable. We use this as my son's going out bink link and we have gotten tons of comments on it!!!",2012-03-11
"625","US",29836894,"R2JA86HPVQDIGU","B003ZMLH34",211963857,"mam night bpa free glow in the dark silicone pacifier, 6 months, 2 pack","Baby",5,0,0,"N","Y","LOVE EM!","My babe loves these pacifiers anyway... but one day my husband says, someone should invent glow in the dark pacifiers Presto! Amazon finds it!",2012-03-11
